{
  "$schema": "http://json-schema.org/draft-07/schema#",
  "type": "object",
  "required": ["name", "age", "email"],
  "properties": {
    "name": { "type": "string" },
    "age": { "type": "integer" },
    "email": { "type": "string", "format": "email" },
    "subjects": { "type": "array", "items": { "type": "string" } }
  }
}
