[
  { "name": "Rudresh Sharma", "age": 21, "email": "rudresh@example.com", "subjects": ["Math", "Physics"] },
  { "name": "Anita Verma", "age": 28, "email": "anita@example.com", "subjects": ["Biology", "Chemistry"] },
  { "name": "Rahul Singh", "age": 30, "email": "rahul@example.com", "subjects": ["History", "Geography"] }
]
